{
  "typingsPath": "D:\\_Editing\\github\\tsd\\tsd-origin\\test\\modules\\api\\tmp\\command\\install\\angularjs-angular\\typings",
  "version": "v4",
  "repo": "borisyankov/DefinitelyTyped",
  "ref": "master",
  "installed": {
    "jquery/jquery.d.ts": {
      "commit": "a8d8c2ac668fbb99cb60fb5d25c663e9356fee14",
      "blob": "99969f710e2dbcac67382988edc7224550d29b86"
    },
    "angularjs/angular.d.ts": {
      "commit": "a8d8c2ac668fbb99cb60fb5d25c663e9356fee14",
      "blob": "c44f3408e4b90c2572045d231a91f6042cf2e8da"
    }
  }
}