{
  "typingsPath": "D:\\_Editing\\github\\tsd\\tsd-origin\\test\\modules\\api\\tmp\\command\\install\\async\\typings",
  "version": "v4",
  "repo": "borisyankov/DefinitelyTyped",
  "ref": "master",
  "installed": {
    "async/async.d.ts": {
      "commit": "a8d8c2ac668fbb99cb60fb5d25c663e9356fee14",
      "blob": "5ba56e0dbb7cc433d5b98ab3cbbf5e0d92954ff1"
    }
  }
}